<?xml version="1.0" encoding="UTF-8"?>
<!DOCTYPE period_perspective SYSTEM "Schedule.dtd">

<period_perspective>
    <period_view time="1130">
        <dayOfWeek day="1"></dayOfWeek>
        <course>ACIT4650Lab</course>
        <instructor>Dargahi, Farnaz</instructor>
        <room>SE12-306</room>
	
        <dayOfWeek day="4"></dayOfWeek>
        <course>ACIT4910Lab</course>
        <instructor>Richard Chau</instructor>
        <room>SE12-306</room>
                
        <dayOfWeek day="5"></dayOfWeek>
        <course>ACIT4770T</course>
        <instructor>Trevor Lord</instructor>
        <room>SE12-306</room>
    </period_view>
</period_perspective>